{
  "$schema": "https://json-schema.org/draft/2020-12/schema",
  "$id": "https://local/ngs_evidence_layer/ingestion_package_schema.json",
  "title": "Phase 2 provisional or Phase 4 final evidence package",
  "type": "object",
  "required": [
    "schema_version",
    "paper_id",
    "round",
    "extraction_date",
    "extraction_model",
    "publication_type",
    "publication_type_basis",
    "publication_type_verified_by_phase3",
    "genes_covered",
    "diseases_covered",
    "census_entries",
    "cards",
    "evidence",
    "audit"
  ],
  "additionalProperties": false,
  "properties": {
    "schema_version": {
      "enum": [
        "5.0",
        "5.1"
      ]
    },
    "paper_id": {
      "type": "string",
      "format": "uuid"
    },
    "round": {
      "type": "integer",
      "minimum": 1
    },
    "extraction_date": {
      "type": "string",
      "format": "date"
    },
    "extraction_model": {
      "type": "string",
      "minLength": 1
    },
    "paper_nickname": {
      "type": "string",
      "minLength": 1,
      "maxLength": 120
    },
    "publication_type": {
      "enum": [
        "guideline",
        "consensus statement",
        "primary study",
        "systematic review",
        "narrative review",
        "other"
      ]
    },
    "publication_type_basis": {
      "type": "string",
      "minLength": 1
    },
    "publication_type_verified_by_phase3": {
      "type": "boolean"
    },
    "genes_covered": {
      "type": "array",
      "uniqueItems": true,
      "items": {
        "$ref": "#/$defs/gene"
      }
    },
    "diseases_covered": {
      "type": "array",
      "uniqueItems": true,
      "items": {
        "$ref": "#/$defs/disease"
      }
    },
    "census_entries": {
      "type": "integer",
      "minimum": 0
    },
    "cards": {
      "type": "array",
      "items": {
        "$ref": "#/$defs/card"
      }
    },
    "evidence": {
      "type": "array",
      "items": {
        "$ref": "#/$defs/evidence"
      }
    },
    "human_decisions": {
      "type": "array",
      "description": "Effective human rulings made at the normal Phase 2 semantic-group review gate. This is provenance/authority for the approved candidate state, not source evidence or a conversational history; superseded rulings are consolidated away.",
      "items": {
        "$ref": "#/$defs/human_decision"
      }
    },
    "audit": {
      "anyOf": [
        {
          "type": "null"
        },
        {
          "$ref": "#/$defs/audit"
        }
      ]
    }
  },
  "$defs": {
    "gene": {
      "type": "string",
      "pattern": "^[A-Z0-9][A-Z0-9\\-]*$"
    },
    "disease": {
      "type": "string",
      "minLength": 1
    },
    "citation": {
      "type": "object",
      "required": [
        "display"
      ],
      "additionalProperties": false,
      "properties": {
        "authors": {
          "type": "array",
          "items": {
            "type": "string"
          }
        },
        "title": {
          "type": "string"
        },
        "journal": {
          "type": "string"
        },
        "year": {
          "type": "integer",
          "minimum": 1950,
          "maximum": 2100
        },
        "volume": {
          "type": "string"
        },
        "issue": {
          "type": "string"
        },
        "pages": {
          "type": "string"
        },
        "display": {
          "type": "string",
          "minLength": 1
        },
        "citation_incomplete": {
          "type": "array",
          "uniqueItems": true,
          "items": {
            "type": "string"
          }
        }
      }
    },
    "card": {
      "type": "object",
      "required": [
        "card_id",
        "locator",
        "interpretation",
        "genes",
        "diseases",
        "category",
        "evidence_tier",
        "secondary_citation"
      ],
      "additionalProperties": false,
      "properties": {
        "card_id": {
          "type": "string",
          "minLength": 1
        },
        "locator": {
          "type": "string",
          "minLength": 1
        },
        "interpretation": {
          "type": "string",
          "minLength": 1
        },
        "genes": {
          "type": "array",
          "uniqueItems": true,
          "items": {
            "$ref": "#/$defs/gene"
          }
        },
        "diseases": {
          "type": "array",
          "uniqueItems": true,
          "items": {
            "$ref": "#/$defs/disease"
          }
        },
        "disease_ancestors": {
          "type": "array",
          "uniqueItems": true,
          "items": {
            "$ref": "#/$defs/disease"
          }
        },
        "category": {
          "enum": [
            "diagnosis",
            "prognosis",
            "treatment",
            "biomarker",
            "germline"
          ]
        },
        "evidence_tier": {
          "enum": [
            "guideline criterion",
            "multivariable-adjusted",
            "univariable or descriptive",
            "restated secondary"
          ]
        },
        "secondary_citation": {
          "anyOf": [
            {
              "type": "null"
            },
            {
              "$ref": "#/$defs/citation"
            }
          ]
        }
      },
      "allOf": [
        {
          "if": {
            "properties": {
              "category": {
                "enum": [
                  "diagnosis",
                  "prognosis",
                  "treatment",
                  "biomarker"
                ]
              }
            },
            "required": [
              "category"
            ]
          },
          "then": {
            "properties": {
              "diseases": {
                "minItems": 1
              }
            }
          }
        },
        {
          "if": {
            "properties": {
              "category": {
                "enum": [
                  "prognosis",
                  "biomarker",
                  "germline"
                ]
              }
            },
            "required": [
              "category"
            ]
          },
          "then": {
            "properties": {
              "genes": {
                "minItems": 1
              }
            }
          }
        }
      ]
    },
    "fragment": {
      "type": "object",
      "required": [
        "fragment_id",
        "role",
        "quote",
        "locator"
      ],
      "additionalProperties": false,
      "properties": {
        "fragment_id": {
          "type": "string",
          "pattern": "^F[0-9]{2}$"
        },
        "role": {
          "enum": [
            "claim",
            "scope_heading",
            "column_header",
            "row_header",
            "cell",
            "legend",
            "footnote"
          ]
        },
        "quote": {
          "type": "string",
          "minLength": 1
        },
        "locator": {
          "type": "string",
          "minLength": 1
        }
      }
    },
    "support_map": {
      "type": "object",
      "minProperties": 1,
      "additionalProperties": false,
      "properties": {
        "gene": {
          "$ref": "#/$defs/fragment_ids"
        },
        "disease": {
          "$ref": "#/$defs/fragment_ids"
        },
        "role": {
          "$ref": "#/$defs/fragment_ids"
        },
        "population": {
          "$ref": "#/$defs/fragment_ids"
        },
        "effect": {
          "$ref": "#/$defs/fragment_ids"
        },
        "qualifier": {
          "$ref": "#/$defs/fragment_ids"
        }
      }
    },
    "fragment_ids": {
      "type": "array",
      "minItems": 1,
      "uniqueItems": true,
      "items": {
        "type": "string",
        "pattern": "^F[0-9]{2}$"
      }
    },
    "table_relation": {
      "type": "object",
      "required": [
        "value_fragment_id",
        "header_fragment_ids",
        "qualifier_fragment_ids"
      ],
      "additionalProperties": false,
      "properties": {
        "value_fragment_id": {
          "type": "string",
          "pattern": "^F[0-9]{2}$"
        },
        "header_fragment_ids": {
          "$ref": "#/$defs/fragment_ids"
        },
        "qualifier_fragment_ids": {
          "type": "array",
          "uniqueItems": true,
          "items": {
            "type": "string",
            "pattern": "^F[0-9]{2}$"
          }
        }
      }
    },
    "evidence": {
      "oneOf": [
        {
          "type": "object",
          "required": [
            "card_id",
            "evidence_type",
            "fragments",
            "support_map"
          ],
          "additionalProperties": false,
          "properties": {
            "card_id": {
              "type": "string",
              "minLength": 1
            },
            "evidence_type": {
              "const": "contiguous_text"
            },
            "fragments": {
              "type": "array",
              "minItems": 1,
              "maxItems": 1,
              "items": {
                "$ref": "#/$defs/fragment"
              }
            },
            "support_map": {
              "$ref": "#/$defs/support_map"
            }
          }
        },
        {
          "type": "object",
          "required": [
            "card_id",
            "evidence_type",
            "fragments",
            "support_map"
          ],
          "additionalProperties": false,
          "properties": {
            "card_id": {
              "type": "string",
              "minLength": 1
            },
            "evidence_type": {
              "const": "composite_text"
            },
            "fragments": {
              "type": "array",
              "minItems": 2,
              "maxItems": 6,
              "items": {
                "$ref": "#/$defs/fragment"
              }
            },
            "support_map": {
              "$ref": "#/$defs/support_map"
            }
          }
        },
        {
          "type": "object",
          "required": [
            "card_id",
            "evidence_type",
            "fragments",
            "support_map",
            "table_relations"
          ],
          "additionalProperties": false,
          "properties": {
            "card_id": {
              "type": "string",
              "minLength": 1
            },
            "evidence_type": {
              "const": "table_relation"
            },
            "fragments": {
              "type": "array",
              "minItems": 2,
              "maxItems": 12,
              "items": {
                "$ref": "#/$defs/fragment"
              }
            },
            "support_map": {
              "$ref": "#/$defs/support_map"
            },
            "table_relations": {
              "type": "array",
              "minItems": 1,
              "items": {
                "$ref": "#/$defs/table_relation"
              }
            }
          }
        }
      ]
    },
    "audit": {
      "type": "object",
      "required": [
        "audit_date",
        "audit_model",
        "extraction_model_reviewed",
        "approved_round",
        "publication_type_verdict",
        "results"
      ],
      "additionalProperties": false,
      "properties": {
        "audit_date": {
          "type": "string",
          "format": "date"
        },
        "audit_model": {
          "type": "string",
          "minLength": 1
        },
        "extraction_model_reviewed": {
          "type": "string",
          "minLength": 1
        },
        "approved_round": {
          "type": "integer",
          "minimum": 1
        },
        "publication_type_verdict": {
          "type": "object",
          "required": [
            "verdict",
            "verified_by_phase3"
          ],
          "additionalProperties": false,
          "properties": {
            "verdict": {
              "enum": [
                "pass",
                "fail"
              ]
            },
            "verified_by_phase3": {
              "const": true
            },
            "reason": {
              "type": "string",
              "minLength": 1
            }
          },
          "allOf": [
            {
              "if": {
                "properties": {
                  "verdict": {
                    "const": "fail"
                  }
                },
                "required": [
                  "verdict"
                ]
              },
              "then": {
                "required": [
                  "reason"
                ]
              }
            }
          ]
        },
        "results": {
          "type": "array",
          "items": {
            "type": "object",
            "required": [
              "card_id",
              "verdict"
            ],
            "additionalProperties": false,
            "properties": {
              "card_id": {
                "type": "string",
                "minLength": 1
              },
              "verdict": {
                "enum": [
                  "pass",
                  "fail"
                ]
              },
              "reason": {
                "type": "string",
                "minLength": 1
              },
              "review_basis": {
                "enum": [
                  "phase3",
                  "carried_forward",
                  "phase4_adjudicated"
                ]
              }
            },
            "allOf": [
              {
                "if": {
                  "properties": {
                    "verdict": {
                      "const": "fail"
                    }
                  },
                  "required": [
                    "verdict"
                  ]
                },
                "then": {
                  "required": [
                    "reason"
                  ]
                }
              }
            ]
          }
        }
      }
    },
    "human_decision": {
      "type": "object",
      "required": [
        "decision_id",
        "action",
        "before_card_ids",
        "after_card_ids",
        "claim_ids",
        "human_instruction",
        "human_reason"
      ],
      "additionalProperties": false,
      "properties": {
        "decision_id": {
          "type": "string",
          "pattern": "^H[0-9]{3,}$"
        },
        "action": {
          "enum": [
            "retain",
            "modify",
            "delete",
            "add",
            "split",
            "merge"
          ]
        },
        "before_card_ids": {
          "type": "array",
          "uniqueItems": true,
          "items": {
            "type": "string",
            "minLength": 1
          }
        },
        "after_card_ids": {
          "type": "array",
          "uniqueItems": true,
          "items": {
            "type": "string",
            "minLength": 1
          }
        },
        "claim_ids": {
          "type": "array",
          "minItems": 1,
          "uniqueItems": true,
          "items": {
            "type": "string",
            "minLength": 1
          }
        },
        "human_instruction": {
          "type": "string",
          "minLength": 1
        },
        "human_reason": {
          "anyOf": [
            {
              "type": "null"
            },
            {
              "type": "string",
              "minLength": 1
            }
          ]
        }
      },
      "allOf": [
        {
          "if": {
            "properties": {
              "action": {
                "const": "delete"
              }
            },
            "required": [
              "action"
            ]
          },
          "then": {
            "properties": {
              "before_card_ids": {
                "minItems": 1
              },
              "after_card_ids": {
                "maxItems": 0
              }
            }
          }
        },
        {
          "if": {
            "properties": {
              "action": {
                "const": "add"
              }
            },
            "required": [
              "action"
            ]
          },
          "then": {
            "properties": {
              "before_card_ids": {
                "maxItems": 0
              },
              "after_card_ids": {
                "minItems": 1
              }
            }
          }
        },
        {
          "if": {
            "properties": {
              "action": {
                "enum": [
                  "retain",
                  "modify"
                ]
              }
            },
            "required": [
              "action"
            ]
          },
          "then": {
            "properties": {
              "before_card_ids": {
                "minItems": 1
              },
              "after_card_ids": {
                "minItems": 1
              }
            }
          }
        },
        {
          "if": {
            "properties": {
              "action": {
                "const": "split"
              }
            },
            "required": [
              "action"
            ]
          },
          "then": {
            "properties": {
              "before_card_ids": {
                "minItems": 1
              },
              "after_card_ids": {
                "minItems": 2
              }
            }
          }
        },
        {
          "if": {
            "properties": {
              "action": {
                "const": "merge"
              }
            },
            "required": [
              "action"
            ]
          },
          "then": {
            "properties": {
              "before_card_ids": {
                "minItems": 2
              },
              "after_card_ids": {
                "minItems": 1
              }
            }
          }
        }
      ]
    }
  }
}
